{
  "$schema": "https://json-schema.org/draft/2020-12/schema",
  "$id": "https://40kdc.dev/schemas/core/unit.schema.json",
  "title": "Unit",
  "description": "A unit datasheet entry with stat profiles and point costs.",
  "type": "object",
  "properties": {
    "id": { "$ref": "../defs/common.schema.json#/$defs/entity-id" },
    "name": { "type": "string", "minLength": 1, "maxLength": 128 },
    "faction_id": { "$ref": "../defs/common.schema.json#/$defs/entity-id" },
    "role": {
      "type": "string",
      "enum": ["character", "battleline", "dedicated-transport", "fortification", "allied", "epic-hero"],
      "description": "Battlefield role from the datasheet header. Unit types (Infantry, Vehicle, etc.) belong in keywords."
    },
    "attachment_role": {
      "oneOf": [
        { "enum": ["leader", "support"] },
        { "type": "null" }
      ],
      "description": "Character attachment role (11e). 'support' implies the unit is only legal when attached to a host unit (cannot be taken solo); 'leader' is valid as a standalone list entry. null/absent for non-attaching units."
    },
    "profiles": {
      "type": "array",
      "items": {
        "type": "object",
        "properties": {
          "name": { "type": "string", "description": "Profile name (e.g., 'Wounded' for degrading)" },
          "M": { "$ref": "../defs/common.schema.json#/$defs/stat-value" },
          "T": { "type": "integer", "minimum": 1 },
          "W": { "type": "integer", "minimum": 1 },
          "Sv": { "type": "integer", "minimum": 2, "maximum": 7 },
          "invuln_sv": {
            "oneOf": [
              { "type": "integer", "minimum": 2, "maximum": 6 },
              { "type": "null" }
            ]
          },
          "Ld": { "type": "integer", "minimum": 2, "maximum": 10 },
          "OC": { "type": "integer", "minimum": 0 }
        },
        "required": ["M", "T", "W", "Sv", "Ld", "OC"]
      },
      "minItems": 1
    },
    "points": {
      "type": "array",
      "items": {
        "type": "object",
        "properties": {
          "models": { "type": "integer", "minimum": 1 },
          "cost": { "type": "integer", "minimum": 0 }
        },
        "required": ["models", "cost"]
      }
    },
    "points_provisional": {
      "type": "boolean",
      "default": false,
      "description": "True when point costs are carried over provisionally (e.g. seeded from a prior edition during migration) and not yet confirmed against the current dataslate."
    },
    "keywords": { "$ref": "../defs/common.schema.json#/$defs/keyword-list" },
    "faction_keywords": { "$ref": "../defs/common.schema.json#/$defs/keyword-list" },
    "base_size_mm": {
      "description": "The unit's representative base (the most-numerous model's base). Mixed-model units carry the full per-model breakdown in unit-composition; this top-level value is a convenience for consumers that need a single base.",
      "oneOf": [
        { "$ref": "../defs/common.schema.json#/$defs/base-size" },
        { "type": "null" }
      ]
    },
    "model_count": {
      "type": "object",
      "properties": {
        "min": { "type": "integer", "minimum": 1 },
        "max": { "type": "integer", "minimum": 1 }
      },
      "required": ["min", "max"]
    },
    "weapon_ids": {
      "type": "array",
      "items": { "$ref": "../defs/common.schema.json#/$defs/entity-id" }
    },
    "ability_ids": {
      "type": "array",
      "items": { "$ref": "../defs/common.schema.json#/$defs/entity-id" }
    },
    "transport_capacity": {
      "oneOf": [
        {
          "type": "object",
          "properties": {
            "capacity": { "type": "integer", "minimum": 1 },
            "keyword_restrictions": {
              "oneOf": [
                { "$ref": "../defs/common.schema.json#/$defs/keyword-list" },
                { "type": "null" }
              ]
            },
            "exclusion_keywords": {
              "oneOf": [
                { "$ref": "../defs/common.schema.json#/$defs/keyword-list" },
                { "type": "null" }
              ]
            }
          },
          "required": ["capacity"],
          "additionalProperties": false
        },
        { "type": "null" }
      ]
    },
    "game_version": { "$ref": "../defs/game-version-ref.schema.json" },
    "is_legend": { "type": "boolean", "default": false }
  },
  "required": ["id", "name", "faction_id", "profiles", "game_version"],
  "additionalProperties": false
}
