[
  {
    "id": "weirdboy",
    "name": "Weirdboy",
    "faction_id": "orks",
    "role": "character",
    "profiles": [
      {
        "name": "Weirdboy",
        "M": 6,
        "T": 5,
        "W": 4,
        "Sv": 5,
        "invuln_sv": null,
        "Ld": 7,
        "OC": 1
      }
    ],
    "points": [
      {
        "models": 1,
        "cost": 65
      }
    ],
    "keywords": [
      "Infantry",
      "Character",
      "Psyker",
      "Weirdboy"
    ],
    "faction_keywords": [
      "Orks"
    ],
    "model_count": {
      "min": 1,
      "max": 1
    },
    "weapon_ids": [
      "eadbanger",
      "weirdboy-staff"
    ],
    "ability_ids": [
      "da-jump-psychic",
      "deadly-demise-d3",
      "leader",
      "waaagh-energy"
    ],
    "game_version": {
      "edition": "11th",
      "dataslate": "pre-launch-provisional"
    },
    "is_legend": false,
    "points_provisional": true,
    "attachment_role": "leader"
  },
  {
    "id": "megatrakk-scrapjet",
    "name": "Megatrakk Scrapjet",
    "faction_id": "orks",
    "profiles": [
      {
        "name": "Megatrakk Scrapjet",
        "M": 12,
        "T": 7,
        "W": 9,
        "Sv": 4,
        "invuln_sv": 6,
        "Ld": 7,
        "OC": 3
      }
    ],
    "points": [
      {
        "models": 1,
        "cost": 75
      }
    ],
    "keywords": [
      "Vehicle",
      "Speed Freeks",
      "Megatrakk Scrapjet"
    ],
    "faction_keywords": [
      "Orks"
    ],
    "model_count": {
      "min": 1,
      "max": 1
    },
    "weapon_ids": [
      "nose-drill",
      "rokkit-kannon",
      "twin-big-shoota",
      "wing-missiles"
    ],
    "ability_ids": [
      "deadly-demise-1",
      "drill-through"
    ],
    "game_version": {
      "edition": "11th",
      "dataslate": "pre-launch-provisional"
    },
    "is_legend": false,
    "points_provisional": true
  },
  {
    "id": "warbikers",
    "name": "Warbikers",
    "faction_id": "orks",
    "profiles": [
      {
        "name": "Warbiker",
        "M": 12,
        "T": 6,
        "W": 3,
        "Sv": 4,
        "invuln_sv": 6,
        "Ld": 7,
        "OC": 2
      },
      {
        "name": "Boss Nob on Warbike",
        "M": 12,
        "T": 6,
        "W": 4,
        "Sv": 4,
        "invuln_sv": 6,
        "Ld": 7,
        "OC": 2
      }
    ],
    "points": [
      {
        "models": 3,
        "cost": 65
      },
      {
        "models": 6,
        "cost": 130
      }
    ],
    "keywords": [
      "Mounted",
      "Grenades",
      "Speed Freeks",
      "Warbikers"
    ],
    "faction_keywords": [
      "Orks"
    ],
    "model_count": {
      "min": 3,
      "max": 6
    },
    "weapon_ids": [
      "big-choppa",
      "choppa",
      "close-combat-weapon",
      "power-klaw",
      "slugga",
      "twin-dakkagun"
    ],
    "ability_ids": [
      "drive-by-dakka"
    ],
    "game_version": {
      "edition": "11th",
      "dataslate": "pre-launch-provisional"
    },
    "is_legend": false,
    "points_provisional": true
  },
  {
    "id": "deffkoptas",
    "name": "Deffkoptas",
    "faction_id": "orks",
    "profiles": [
      {
        "name": "Deffkoptas",
        "M": 12,
        "T": 6,
        "W": 4,
        "Sv": 4,
        "invuln_sv": 6,
        "Ld": 7,
        "OC": 2
      }
    ],
    "points": [
      {
        "models": 3,
        "cost": 80
      },
      {
        "models": 6,
        "cost": 160
      }
    ],
    "keywords": [
      "Vehicle",
      "Fly",
      "Grenades",
      "Speed Freeks",
      "Deffkoptas"
    ],
    "faction_keywords": [
      "Orks"
    ],
    "model_count": {
      "min": 3,
      "max": 6
    },
    "weapon_ids": [
      "kopta-rokkits",
      "kustom-mega-blasta",
      "slugga",
      "spinnin-blades"
    ],
    "ability_ids": [
      "deep-strike",
      "deff-from-above"
    ],
    "game_version": {
      "edition": "11th",
      "dataslate": "pre-launch-provisional"
    },
    "is_legend": false,
    "points_provisional": true
  },
  {
    "id": "kustom-boosta-blasta",
    "name": "Kustom Boosta-blasta",
    "faction_id": "orks",
    "profiles": [
      {
        "name": "Kustom Boosta-blasta",
        "M": 12,
        "T": 7,
        "W": 9,
        "Sv": 4,
        "invuln_sv": 6,
        "Ld": 7,
        "OC": 3
      }
    ],
    "points": [
      {
        "models": 1,
        "cost": 70
      }
    ],
    "keywords": [
      "Vehicle",
      "Grenades",
      "Speed Freeks",
      "Kustom Boost-blasta"
    ],
    "faction_keywords": [
      "Orks"
    ],
    "model_count": {
      "min": 1,
      "max": 1
    },
    "weapon_ids": [
      "burna-exhausts",
      "grot-blasta",
      "rivet-kannon",
      "spiked-ram"
    ],
    "ability_ids": [
      "rivetin-dakka"
    ],
    "game_version": {
      "edition": "11th",
      "dataslate": "pre-launch-provisional"
    },
    "is_legend": false,
    "points_provisional": true
  },
  {
    "id": "painboy",
    "name": "Painboy",
    "faction_id": "orks",
    "role": "character",
    "profiles": [
      {
        "name": "Painboy",
        "M": 6,
        "T": 5,
        "W": 3,
        "Sv": 5,
        "invuln_sv": null,
        "Ld": 7,
        "OC": 1
      }
    ],
    "points": [
      {
        "models": 1,
        "cost": 80
      }
    ],
    "keywords": [
      "Infantry",
      "Character",
      "Painboy"
    ],
    "faction_keywords": [
      "Orks"
    ],
    "model_count": {
      "min": 1,
      "max": 1
    },
    "weapon_ids": [
      "power-klaw",
      "urty-syringe"
    ],
    "ability_ids": [
      "dok-s-toolz",
      "grot-orderly",
      "hold-still-and-say-aargh",
      "leader"
    ],
    "game_version": {
      "edition": "11th",
      "dataslate": "pre-launch-provisional"
    },
    "is_legend": false,
    "points_provisional": true,
    "attachment_role": "leader"
  },
  {
    "id": "killa-kans",
    "name": "Killa Kans",
    "faction_id": "orks",
    "profiles": [
      {
        "name": "Killa Kans",
        "M": 6,
        "T": 6,
        "W": 5,
        "Sv": 3,
        "invuln_sv": 6,
        "Ld": 8,
        "OC": 2
      }
    ],
    "points": [
      {
        "models": 3,
        "cost": 125
      },
      {
        "models": 6,
        "cost": 250
      }
    ],
    "keywords": [
      "Vehicle",
      "Walker",
      "Grots",
      "Killa Kans"
    ],
    "faction_keywords": [
      "Orks"
    ],
    "model_count": {
      "min": 3,
      "max": 6
    },
    "weapon_ids": [
      "grotzooka",
      "kan-klaw",
      "kan-shoota",
      "rokkit-launcha",
      "skorcha"
    ],
    "ability_ids": [
      "shooty-power-trip"
    ],
    "game_version": {
      "edition": "11th",
      "dataslate": "pre-launch-provisional"
    },
    "is_legend": false,
    "points_provisional": true
  },
  {
    "id": "lootas",
    "name": "Lootas",
    "faction_id": "orks",
    "profiles": [
      {
        "name": "Loota",
        "M": 6,
        "T": 5,
        "W": 1,
        "Sv": 5,
        "invuln_sv": null,
        "Ld": 7,
        "OC": 1
      }
    ],
    "points": [
      {
        "models": 5,
        "cost": 50
      },
      {
        "models": 10,
        "cost": 100
      }
    ],
    "keywords": [
      "Infantry",
      "Lootas"
    ],
    "faction_keywords": [
      "Orks"
    ],
    "model_count": {
      "min": 5,
      "max": 10
    },
    "weapon_ids": [
      "big-shoota",
      "close-combat-weapon",
      "deffgun",
      "kustom-mega-blasta",
      "rokkit-launcha"
    ],
    "ability_ids": [
      "dat-s-our-loot"
    ],
    "game_version": {
      "edition": "11th",
      "dataslate": "pre-launch-provisional"
    },
    "is_legend": false,
    "points_provisional": true
  },
  {
    "id": "big-mek",
    "name": "Big Mek",
    "faction_id": "orks",
    "role": "character",
    "profiles": [
      {
        "name": "Big Mek",
        "M": 6,
        "T": 5,
        "W": 6,
        "Sv": 3,
        "invuln_sv": null,
        "Ld": 7,
        "OC": 1
      }
    ],
    "points": [
      {
        "models": 1,
        "cost": 70
      }
    ],
    "keywords": [
      "Infantry",
      "Character",
      "Grenades",
      "Mek",
      "Big Mek"
    ],
    "faction_keywords": [
      "Orks"
    ],
    "model_count": {
      "min": 1,
      "max": 1
    },
    "weapon_ids": [
      "drilla",
      "kustom-mega-blasta",
      "power-klaw",
      "traktor-blasta"
    ],
    "ability_ids": [
      "leader",
      "more-dakka",
      "shokk-boosta"
    ],
    "game_version": {
      "edition": "11th",
      "dataslate": "pre-launch-provisional"
    },
    "is_legend": false,
    "points_provisional": true,
    "attachment_role": "leader"
  },
  {
    "id": "squighog-boyz",
    "name": "Squighog Boyz",
    "faction_id": "orks",
    "profiles": [
      {
        "name": "Squighog Boy",
        "M": 10,
        "T": 7,
        "W": 3,
        "Sv": 4,
        "invuln_sv": null,
        "Ld": 7,
        "OC": 2
      },
      {
        "name": "Nob on Smasha Squig",
        "M": 10,
        "T": 7,
        "W": 4,
        "Sv": 4,
        "invuln_sv": null,
        "Ld": 7,
        "OC": 2
      }
    ],
    "points": [
      {
        "models": 4,
        "cost": 150
      },
      {
        "models": 8,
        "cost": 300
      }
    ],
    "keywords": [
      "Mounted",
      "Beast Snagga",
      "Grenades",
      "Squighog Boyz"
    ],
    "faction_keywords": [
      "Orks"
    ],
    "model_count": {
      "min": 4,
      "max": 8
    },
    "weapon_ids": [
      "big-choppa",
      "saddlegit-weapons",
      "slugga",
      "squig-jaws",
      "stikka"
    ],
    "ability_ids": [
      "bomb-squig",
      "feel-no-pain-5",
      "wild-ride"
    ],
    "game_version": {
      "edition": "11th",
      "dataslate": "pre-launch-provisional"
    },
    "is_legend": false,
    "points_provisional": true
  },
  {
    "id": "warboss-in-mega-armour",
    "name": "Warboss in Mega Armour",
    "faction_id": "orks",